{
  "$schema": "https://json-schema.org/draft/2020-12/schema",
  "$id": "https://github.com/EnjoyableWork/mcp-doctor/blob/main/schemas/mcp-doctor.capabilities.v1.schema.json",
  "title": "mcp-doctor compiled capability response",
  "description": "The stable mcp-doctor.capabilities/v1 contract. A successful document reports compiled product capabilities only. An unsupported exact schema request may return the value-free error branch with exit 2. Unknown optional properties are compatible within v1 and must be ignored.",
  "type": "object",
  "required": [
    "schema_version",
    "schema_stability"
  ],
  "properties": {
    "schema_version": {
      "const": "mcp-doctor.capabilities/v1"
    },
    "schema_stability": {
      "const": "stable"
    },
    "product": {
      "$ref": "#/$defs/product"
    },
    "commands": {
      "type": "array",
      "minItems": 1,
      "maxItems": 64,
      "uniqueItems": true,
      "items": {
        "$ref": "#/$defs/command"
      }
    },
    "protocol_revisions": {
      "type": "array",
      "maxItems": 32,
      "uniqueItems": true,
      "items": {
        "$ref": "#/$defs/protocol_revision"
      }
    },
    "protocol_support": {
      "type": "array",
      "maxItems": 128,
      "uniqueItems": true,
      "items": {
        "$ref": "#/$defs/protocol_support"
      }
    },
    "protocol_selection": {
      "$ref": "#/$defs/protocol_selection"
    },
    "schema_versions": {
      "$ref": "#/$defs/schema_versions"
    },
    "status": {
      "$ref": "#/$defs/status"
    },
    "interruption": {
      "$ref": "#/$defs/interruption"
    },
    "reporters": {
      "type": "array",
      "minItems": 1,
      "maxItems": 16,
      "uniqueItems": true,
      "items": {
        "$ref": "#/$defs/reporter"
      }
    },
    "exit_semantics": {
      "$ref": "#/$defs/exit_semantics"
    },
    "platform": {
      "$ref": "#/$defs/platform"
    },
    "limit_profiles": {
      "type": "array",
      "minItems": 1,
      "maxItems": 32,
      "uniqueItems": true,
      "items": {
        "$ref": "#/$defs/limit_profile"
      }
    },
    "diagnostic_time_ceiling_profiles": {
      "type": "array",
      "minItems": 2,
      "maxItems": 2,
      "uniqueItems": true,
      "items": {
        "$ref": "#/$defs/diagnostic_time_ceiling_profile"
      }
    },
    "limits": {
      "$ref": "#/$defs/limits"
    },
    "error": {
      "$ref": "#/$defs/error"
    }
  },
  "oneOf": [
    {
      "required": [
        "product",
        "commands",
        "protocol_revisions",
        "protocol_support",
        "schema_versions",
        "reporters",
        "exit_semantics",
        "platform",
        "limit_profiles",
        "limits"
      ],
      "not": {
        "required": [
          "error"
        ]
      }
    },
    {
      "required": [
        "error"
      ],
      "not": {
        "required": [
          "product"
        ]
      }
    }
  ],
  "additionalProperties": true,
  "$defs": {
    "name": {
      "type": "string",
      "pattern": "^[a-z][a-z0-9_-]*$",
      "maxLength": 64
    },
    "contract_version": {
      "type": "string",
      "pattern": "^mcp-doctor\\.[a-z][a-z0-9-]*/v[0-9]+(?:alpha[0-9]+)?$",
      "maxLength": 128
    },
    "contract_versions": {
      "type": "array",
      "maxItems": 16,
      "uniqueItems": true,
      "items": {
        "$ref": "#/$defs/contract_version"
      }
    },
    "product": {
      "type": "object",
      "required": [
        "name",
        "version"
      ],
      "properties": {
        "name": {
          "const": "mcp-doctor"
        },
        "version": {
          "type": "string",
          "pattern": "^[0-9]+\\.[0-9]+\\.[0-9]+(?:-[0-9A-Za-z.-]+)?$",
          "maxLength": 64
        }
      },
      "additionalProperties": true
    },
    "command": {
      "type": "object",
      "required": [
        "name",
        "activity",
        "reporters",
        "input_schema_versions",
        "output_schema_versions",
        "generator_versions",
        "limit_profile"
      ],
      "properties": {
        "name": {
          "$ref": "#/$defs/name"
        },
        "activity": {
          "$ref": "#/$defs/name"
        },
        "reporters": {
          "type": "array",
          "minItems": 1,
          "maxItems": 16,
          "uniqueItems": true,
          "items": {
            "$ref": "#/$defs/name"
          }
        },
        "artifact_reporters": {
          "type": "array",
          "maxItems": 16,
          "uniqueItems": true,
          "items": {
            "$ref": "#/$defs/name"
          }
        },
        "input_schema_versions": {
          "$ref": "#/$defs/contract_versions"
        },
        "output_schema_versions": {
          "$ref": "#/$defs/contract_versions"
        },
        "generator_versions": {
          "$ref": "#/$defs/contract_versions"
        },
        "limit_profile": {
          "$ref": "#/$defs/limit_profile_id"
        }
      },
      "additionalProperties": true
    },
    "revision": {
      "type": "string",
      "pattern": "^[0-9]{4}-[0-9]{2}-[0-9]{2}$",
      "maxLength": 10
    },
    "protocol_revision": {
      "type": "object",
      "required": [
        "revision",
        "recognition"
      ],
      "properties": {
        "revision": {
          "$ref": "#/$defs/revision"
        },
        "recognition": {
          "$ref": "#/$defs/name"
        }
      },
      "additionalProperties": true
    },
    "protocol_support": {
      "type": "object",
      "required": [
        "command",
        "transport",
        "revisions"
      ],
      "properties": {
        "command": {
          "$ref": "#/$defs/name"
        },
        "transport": {
          "$ref": "#/$defs/name"
        },
        "revisions": {
          "type": "array",
          "minItems": 1,
          "maxItems": 32,
          "uniqueItems": true,
          "items": {
            "$ref": "#/$defs/revision"
          }
        }
      },
      "additionalProperties": true
    },
    "protocol_selection": {
      "type": "object",
      "required": [
        "command",
        "default_mode",
        "modes",
        "compiled_modern_revisions",
        "exact_revisions",
        "exact_max_lifecycle_requests",
        "exact_max_fallbacks",
        "auto_transports"
      ],
      "properties": {
        "command": {
          "const": "inspect"
        },
        "default_mode": {
          "const": "auto"
        },
        "modes": {
          "type": "array",
          "minItems": 1,
          "maxItems": 8,
          "uniqueItems": true,
          "items": {
            "$ref": "#/$defs/name"
          }
        },
        "compiled_modern_revisions": {
          "type": "array",
          "minItems": 1,
          "maxItems": 32,
          "uniqueItems": true,
          "items": {
            "$ref": "#/$defs/revision"
          }
        },
        "exact_revisions": {
          "type": "array",
          "minItems": 1,
          "maxItems": 32,
          "uniqueItems": true,
          "items": {
            "$ref": "#/$defs/revision"
          }
        },
        "exact_max_lifecycle_requests": {
          "$ref": "#/$defs/selection_count"
        },
        "exact_max_fallbacks": {
          "$ref": "#/$defs/selection_count"
        },
        "auto_transports": {
          "type": "array",
          "minItems": 1,
          "maxItems": 8,
          "uniqueItems": true,
          "items": {
            "$ref": "#/$defs/auto_selection_transport"
          }
        }
      },
      "additionalProperties": true
    },
    "auto_selection_transport": {
      "type": "object",
      "required": [
        "transport",
        "legacy_path",
        "max_prepared_targets",
        "max_process_launches",
        "max_lifecycle_requests",
        "max_lifecycle_notifications",
        "max_fallbacks",
        "shared_total_and_aggregate_budgets"
      ],
      "properties": {
        "transport": {
          "$ref": "#/$defs/name"
        },
        "legacy_path": {
          "$ref": "#/$defs/name"
        },
        "max_prepared_targets": {
          "$ref": "#/$defs/selection_count"
        },
        "max_process_launches": {
          "$ref": "#/$defs/selection_count"
        },
        "max_lifecycle_requests": {
          "$ref": "#/$defs/selection_count"
        },
        "max_lifecycle_notifications": {
          "$ref": "#/$defs/selection_count"
        },
        "max_fallbacks": {
          "$ref": "#/$defs/selection_count"
        },
        "shared_total_and_aggregate_budgets": {
          "type": "boolean"
        }
      },
      "additionalProperties": true
    },
    "selection_count": {
      "type": "integer",
      "minimum": 0,
      "maximum": 2
    },
    "schema_versions": {
      "type": "object",
      "required": [
        "aggregate",
        "capabilities",
        "contract_diff",
        "contract_snapshot",
        "diagnostic_report",
        "generator",
        "scenario"
      ],
      "properties": {
        "aggregate": {
          "$ref": "#/$defs/nonempty_contract_versions"
        },
        "capabilities": {
          "$ref": "#/$defs/nonempty_contract_versions"
        },
        "contract_diff": {
          "$ref": "#/$defs/nonempty_contract_versions"
        },
        "contract_snapshot": {
          "$ref": "#/$defs/nonempty_contract_versions"
        },
        "diagnostic_report": {
          "$ref": "#/$defs/nonempty_contract_versions"
        },
        "markdown_report": {
          "$ref": "#/$defs/nonempty_contract_versions"
        },
        "badge_report": {
          "$ref": "#/$defs/nonempty_contract_versions"
        },
        "generator": {
          "$ref": "#/$defs/nonempty_contract_versions"
        },
        "scenario": {
          "$ref": "#/$defs/nonempty_contract_versions"
        },
        "status": {
          "$ref": "#/$defs/nonempty_contract_versions"
        }
      },
      "additionalProperties": true
    },
    "nonempty_contract_versions": {
      "$ref": "#/$defs/contract_versions",
      "minItems": 1
    },
    "reporter": {
      "type": "object",
      "required": [
        "name",
        "machine_readable"
      ],
      "properties": {
        "name": {
          "$ref": "#/$defs/name"
        },
        "machine_readable": {
          "type": "boolean"
        }
      },
      "additionalProperties": true
    },
    "exit_semantics": {
      "type": "object",
      "required": [
        "version",
        "codes"
      ],
      "properties": {
        "version": {
          "const": "mcp-doctor.exit/v1"
        },
        "codes": {
          "type": "array",
          "minItems": 1,
          "maxItems": 256,
          "uniqueItems": true,
          "items": {
            "$ref": "#/$defs/exit_code"
          }
        }
      },
      "additionalProperties": true
    },
    "exit_code": {
      "type": "object",
      "required": [
        "code",
        "meaning"
      ],
      "properties": {
        "code": {
          "type": "integer",
          "minimum": 0,
          "maximum": 255
        },
        "meaning": {
          "$ref": "#/$defs/name"
        }
      },
      "additionalProperties": true
    },
    "platform": {
      "type": "object",
      "required": [
        "family",
        "process_tree_control",
        "file_identity"
      ],
      "properties": {
        "family": {
          "$ref": "#/$defs/name"
        },
        "process_tree_control": {
          "$ref": "#/$defs/name"
        },
        "file_identity": {
          "$ref": "#/$defs/name"
        },
        "process_cleanup": {
          "$ref": "#/$defs/process_cleanup"
        }
      },
      "additionalProperties": true
    },
    "process_cleanup": {
      "description": "Optional compiled Unix STDIO process-control scope. These fixed facts do not inspect the host or assert termination of detached descendants.",
      "type": "object",
      "required": [
        "mechanism",
        "scope",
        "descendant_containment",
        "detached_descendants"
      ],
      "properties": {
        "mechanism": {
          "const": "process_group"
        },
        "scope": {
          "const": "direct_child_and_original_process_group"
        },
        "descendant_containment": {
          "const": false
        },
        "detached_descendants": {
          "const": "unverified"
        }
      },
      "additionalProperties": true
    },
    "limit_profile_id": {
      "type": "string",
      "pattern": "^mcp-doctor\\.limits/[a-z][a-z0-9-]*/v[0-9]+(?:alpha[0-9]+)?$",
      "maxLength": 128
    },
    "limit_profile": {
      "type": "object",
      "required": [
        "id",
        "default_for",
        "hard"
      ],
      "properties": {
        "id": {
          "$ref": "#/$defs/limit_profile_id"
        },
        "default_for": {
          "type": "array",
          "minItems": 1,
          "maxItems": 64,
          "uniqueItems": true,
          "items": {
            "$ref": "#/$defs/name"
          }
        },
        "hard": {
          "const": true
        },
        "selections": {
          "description": "Invocation-local names compiled into this limit contract; an empty list means the contract is not selectable.",
          "type": "array",
          "maxItems": 16,
          "uniqueItems": true,
          "items": {
            "$ref": "#/$defs/name"
          }
        },
        "selectable_for": {
          "description": "Commands that accept an explicit selection from this entry.",
          "type": "array",
          "maxItems": 64,
          "uniqueItems": true,
          "items": {
            "$ref": "#/$defs/name"
          }
        }
      },
      "additionalProperties": true
    },
    "status": {
      "type": "object",
      "required": [
        "schema_version",
        "commands",
        "representations",
        "stream",
        "default",
        "jsonl_stderr_exclusive",
        "limits"
      ],
      "properties": {
        "schema_version": {
          "const": "mcp-doctor.status/v1"
        },
        "commands": {
          "type": "array",
          "minItems": 4,
          "maxItems": 4,
          "uniqueItems": true,
          "items": {
            "enum": [
              "break",
              "check",
              "inspect",
              "reject"
            ]
          }
        },
        "representations": {
          "type": "array",
          "minItems": 2,
          "maxItems": 2,
          "uniqueItems": true,
          "items": {
            "$ref": "#/$defs/status_representation"
          }
        },
        "stream": {
          "const": "stderr"
        },
        "default": {
          "const": "off"
        },
        "jsonl_stderr_exclusive": {
          "const": true
        },
        "limits": {
          "$ref": "#/$defs/status_limits"
        }
      },
      "additionalProperties": true
    },
    "status_representation": {
      "type": "object",
      "required": [
        "name",
        "machine_readable"
      ],
      "properties": {
        "name": {
          "enum": [
            "plain",
            "jsonl"
          ]
        },
        "machine_readable": {
          "type": "boolean"
        }
      },
      "additionalProperties": true
    },
    "status_limits": {
      "type": "object",
      "required": [
        "event_bytes",
        "events",
        "output_bytes",
        "write_retries"
      ],
      "properties": {
        "event_bytes": {
          "const": 512
        },
        "events": {
          "const": 128
        },
        "output_bytes": {
          "const": 65536
        },
        "write_retries": {
          "const": 0
        }
      },
      "additionalProperties": true
    },
    "interruption": {
      "type": "object",
      "required": [
        "platform_family",
        "transport",
        "commands",
        "signals",
        "graceful_cleanup_ms",
        "forced_reap_ms",
        "cleanup_ceiling_ms",
        "incomplete_exit_code",
        "status_completion_reason",
        "publishes_report",
        "repeated_signal_forces_exit"
      ],
      "properties": {
        "platform_family": {
          "const": "unix"
        },
        "transport": {
          "const": "stdio"
        },
        "commands": {
          "type": "array",
          "const": [
            "break",
            "check",
            "inspect",
            "reject"
          ]
        },
        "signals": {
          "type": "array",
          "const": [
            "SIGINT",
            "SIGTERM"
          ]
        },
        "graceful_cleanup_ms": {
          "const": 2000
        },
        "forced_reap_ms": {
          "const": 2000
        },
        "cleanup_ceiling_ms": {
          "const": 4000
        },
        "incomplete_exit_code": {
          "const": 3
        },
        "status_completion_reason": {
          "const": "interrupted"
        },
        "publishes_report": {
          "const": false
        },
        "repeated_signal_forces_exit": {
          "const": false
        }
      },
      "additionalProperties": true
    },
    "diagnostic_time_ceiling_profile": {
      "type": "object",
      "required": [
        "profile",
        "startup",
        "discovery",
        "request",
        "response",
        "cleanup_grace",
        "total",
        "whole_process_exit_guarantee"
      ],
      "properties": {
        "profile": {
          "enum": [
            "default",
            "slow-start"
          ]
        },
        "startup": {
          "$ref": "#/$defs/time_ceiling"
        },
        "discovery": {
          "$ref": "#/$defs/time_ceiling"
        },
        "request": {
          "$ref": "#/$defs/time_ceiling"
        },
        "response": {
          "$ref": "#/$defs/time_ceiling"
        },
        "cleanup_grace": {
          "$ref": "#/$defs/time_ceiling"
        },
        "total": {
          "$ref": "#/$defs/time_ceiling"
        },
        "whole_process_exit_guarantee": {
          "const": false
        }
      },
      "additionalProperties": true
    },
    "time_ceiling": {
      "type": "object",
      "required": [
        "milliseconds",
        "scope"
      ],
      "properties": {
        "milliseconds": {
          "type": "integer",
          "minimum": 1,
          "maximum": 240000
        },
        "scope": {
          "$ref": "#/$defs/name"
        }
      },
      "additionalProperties": true
    },
    "limits": {
      "type": "object",
      "required": [
        "output_bytes"
      ],
      "properties": {
        "output_bytes": {
          "const": 65536
        },
        "runtime_shutdown_timeout_ms": {
          "const": 100
        }
      },
      "additionalProperties": true
    },
    "error": {
      "type": "object",
      "required": [
        "code",
        "supported_schema_versions"
      ],
      "properties": {
        "code": {
          "const": "unsupported_schema_version"
        },
        "supported_schema_versions": {
          "type": "array",
          "minItems": 1,
          "maxItems": 16,
          "uniqueItems": true,
          "items": {
            "$ref": "#/$defs/contract_version"
          }
        }
      },
      "additionalProperties": true
    }
  }
}
